{
  "artifact_kind": "next_iter_plan",
  "run_id": "run-0001",
  "iteration_id": "iter-0001",
  "restart_mode": "REITERATE_FROM_CANDIDATE",
  "next_base_ref": "origin/main",
  "carry_patch": true,
  "tighten": {},
  "meta": {
    "policy_linkage": {
      "reason_codes_ref": {
        "path": "control/ssot/reason_codes.json",
        "version": "0.1"
      }
    },
    "requirements": {
      "required_evidence": []
    },
    "guards": {
      "spec": [],
      "eval": []
    }
  }
}
